{
  "verdict": "approve",
  "round": 2,
  "reviewer": "architect-reviewer",
  "reasoning": "Every round-1 finding is answered in the artifacts. The orphan commit path is staged explicitly and a test runs it end to end. The two platform reads not observed in a run are declared as such, and either one failing turns the confirmation run red. The three unasserted clauses now have assertions in tasks 1.1, 1.4 and 1.5.",
  "classes": {
    "simpler": {
      "evidence": "Unchanged from round 1. D1 rejects moving the script into the plugin: the runner still needs the trusted checkout, and head_review.py would end up in two places (ADR 0012). D3 rejects the issue's manual branch row: the workflow already holds a token that can write. D2's optional input and secret let an unset value reach the gap row. D4 shares one secret-name read. I found no simpler design that meets the scenarios.",
      "result": "ok"
    },
    "map": {
      "evidence": "All 13 delta scenarios map to named tests, and the existing ones exist. 'First task of a repository' now maps to test_first_task_of_a_repository and to test_first_record_creates_the_branch. Task 1.2 now runs both the Prepare and the Record-and-push steps, with a stub script, against a temporary bare origin. On the first run it expects one commit whose ls-tree is only task-readings.csv, holding the header and the row. On the second run onto the branch it expects two commits and both rows. That proves the scenario's THEN, including the untracked-file case I reproduced in round 1.",
      "result": "ok"
    },
    "red": {
      "evidence": "Tasks 1.1–1.5 add or extend the tests: absent CSV, unset GRAFANA_URL, the vcs_repository_name filter, the two-step first and second record, the callee schema, the caller render with exact values, and the harness rows with `_gh_kind`. Task 1.6 runs check_red with their node ids and commits RED before implementation.",
      "result": "ok"
    },
    "platform": {
      "evidence": "Observed: job.workflow_sha and the caller's github.repository, github.token and github.event.pull_request.* in a callee (production reusable-agent-review.yml, ADR 0031); `ls-remote --exit-code` exit 2 and the one-file orphan push (D3, git 2.45.1); `gh variable list --json name` printing `[{\"name\":\"GRAFANA_URL\"}]` (D4, gh 2.87.3); kinozal's rulesets covering only main (D3, gh api, 2026-10-13). Declared unobserved, with a visible catcher: `repository.default_branch` in the workflow_dispatch and pull_request payloads (D1, which cites GitHub's webhook docs), and a GITHUB_TOKEN creating a branch by push (D3). Neither fails without notice. A refused push fails the step red. An empty ref makes checkout fall back to the event's ref, and the post-release confirmation run on kinozal checks both. Accepted as honest declarations. Optional: D1 could name the docs page and sentence.",
      "result": "ok"
    },
    "replaced": {
      "evidence": "D1 replaces `ref: main` with `github.event.repository.default_branch` and the `ref: main` script source with the job.workflow_sha trusted checkout, which keeps the workflow-commit guard. D2 replaces the workflow's own `vars.GRAFANA_URL` with the caller-supplied `grafana_url`; an unset value goes to the gap row, which test_grafana_unreachable[unset-credential] catches. D3 drops the second `actions/checkout ref: task-readings`. It now says that guarantee (a tracked CSV) is lost on the orphan, stages the file with `git -C readings add task-readings.csv`, commits and pushes when `diff --cached --quiet` fails, and names test_first_record_creates_the_branch as the catcher. That test is reached at the Verify `test` run and at agent-process / quality on the PR head.",
      "result": "ok"
    },
    "catcher": {
      "evidence": "test_grafana_unreachable[unset-credential] (D2) and test_first_record_creates_the_branch (D3) are reached by the Verify `test` and by quality on the PR head. A concurrent first run gives a rejected push, a red run, and a re-record when the person dispatches. A refused branch-creation push fails the step red. The confirmation run on ekolvah/kinozal_scraper after the release is reported on tracking issue 415, and the design states that the delivery PR cannot prove it.",
      "result": "ok"
    },
    "length": {
      "evidence": "Word counts, with the tests that assert them. measurement 'Merged task records its readings', 135 words, including the 22-word first-run sentence: the script tests and the 1.2 two-step test (branch created, holding only the CSV). 'Non-task PR records nothing', 23 words: 1.3 (default-branch checkout) and test_release_pr_merged. ADDED 'Readings come from the repository's own stack', 33 words: 1.3 on the callee side, 1.4 on the caller's exact values, and 1.1's vcs_repository_name assertion in test_task_pr_merged. Its scenario, 34 words: the extended unset case. distribution 'The installed footprint is closed', 116 words with 4 added, and 'nine': CONSUMER_FILES. 'Observed done', 52 words: 1.5. 'Actions credentials are printed, not set', 116 words with about 70 added: the 1.5 row assertions, and the `_gh_kind` loop with `variable list` as a read for 'writes … a variable'. ADDED 'The task-readings caller runs at the release tag', 69 words: 1.4's triggers, `if`, `uses` and exact `with`/`secrets`. SKILL.md Install step 4, about 10 words, is a prose pointer and asserts nothing, which is acceptable.",
      "result": "ok"
    },
    "bespoke": {
      "evidence": "reusable-task-readings.yml follows the established callee pattern (D1, ADR 0012). The 'Prepare the readings worktree' step (D3) replaces actions/checkout, which cannot check out an absent ref; the issue's manual-row alternative is rejected. The `manual task-readings` row (D4) closes the red first run, and D2 says why `required: true` on workflow_call does not fit. Each has a decision that names its problem and the standard it replaces.",
      "result": "ok"
    }
  },
  "scenario_coverage": []
}
