{
  "verdict": "approve",
  "round": 2,
  "reviewer": "architect-reviewer",
  "reasoning": "Round 2: all three round-1 findings are closed. D3 caps the diagrams and names the cuts, so the line budget closes on paper (about 97 lines). D1 places /agent-process:init and .claude/commands/opsx/ where init.py puts them. The render check now rests on the owner's approval, which the ruleset requires before merge.",
  "classes": {
    "simpler": {
      "evidence": "D3 rejects SVG/PNG (a second source plus a render step) and ASCII (unreadable at phone width). Plain fenced Mermaid stays the simplest carrier. D1 uses one node per component group, and D3 caps each diagram at 14 lines including fences. D3 names the cuts: the 'What it is' bullets (README.md:22-30) become one sentence, and the Why table drops its status clause (README.md:16). The budget is 73 - 8 + 28 + about 4 blank lines, roughly 97, and task 2.2 checks both the per-diagram cap and `wc -l`. The cap is tight for D1: 3 subgraphs and 9 group nodes fit in 12 content lines only when each subgraph's nodes share a line, using Mermaid's `;` statement separator. That is feasible and affects only the source, not the render. One non-blocking note for the implementer: the one-sentence replacement should keep the existing SKILL.md and OpenSpec links, which the diagram cannot carry.",
      "result": "ok"
    },
    "map": {
      "evidence": ".openspec.yaml has skip_specs: true. There is no spec delta, so there is no scenario, and the tasks.md Scenario → test map gives n/a with the reason.",
      "result": "ok"
    },
    "red": {
      "evidence": "tasks.md 1.1 reads 'no RED: docs-only, `skip_specs`'. §I exempts docs-only changes.",
      "result": "ok"
    },
    "platform": {
      "evidence": "Observed: proposal Why quotes GitHub's Creating diagrams page for Mermaid in a `mermaid` fenced block. test_doc_links.py:117 and the test at :295 show that fenced content is a `fence` token, never a link. D1 now matches the repository: the plugin's commands/ holds only init.md, and `.claude/commands/opsx/` is installed by `openspec init --tools claude` during init (init.py:99, :113, :399), with the citation beside the decision. The D2 status flow matches openspec/specs/state/spec.md:10-11.",
      "result": "ok"
    },
    "replaced": {
      "evidence": "No project-declared input is replaced and no guard is dropped. The removed prose (the D1 bullets and the Why status clause) is user-facing text that nothing reads mechanically. The Risks section accepts drift against SKILL.md, following the archived add-readme D2 precedent.",
      "result": "ok"
    },
    "catcher": {
      "evidence": "Link breakage: task 2.2 runs test_doc_links.py, and the declared test that 3.3 runs (ci_check.py) reaches it again. The no-issue-refs hook (.pre-commit-config.yaml:16-22) does not exclude README.md and fires at the 2.3 commit. Mermaid syntax errors: Risks records that GitHub renders client-side, so the agent cannot see an error box. Task 4.1's PR report asks the owner to confirm both diagrams render on the PR's README before approving. The owner's approval is required by the branch ruleset before merge, so this catcher is reached on the PR head. The unobservable agent check (old 4.2) is gone.",
      "result": "ok"
    },
    "length": {
      "evidence": "The plan adds or edits no rule or spec sentence. README.md is user-facing docs, and always-on.md, SKILL.md and openspec/specs/ are untouched.",
      "result": "ok"
    },
    "bespoke": {
      "evidence": "No script or check is added. The plan reuses test_doc_links.py and the existing hooks, and Risks explicitly declines a drift check and a local renderer (§VII).",
      "result": "ok"
    }
  },
  "scenario_coverage": []
}
