{
  "verdict": "approve",
  "round": 2,
  "reviewer": "architect-reviewer",
  "reasoning": "All four round-1 findings are fixed in the artifacts. RED is limited to tests that fail on the current code, the dirty case is reached on its own reason, every platform claim has its observation beside it, and the spec's deletion condition now matches D3.",
  "classes": {
    "simpler": {
      "evidence": "Simpler designs considered: add `git branch -D` to the existing worktree loop and leave the backlog to a manual step; `git branch -d`; upstream `gone` as the signal; a second loop; one bulk `gh pr list`. The scenario 'Merged change's branch' (branches in no worktree, which make up the observed 54-branch backlog) rules out the first. A manual step would be prose (Scripts over instructions). design.md D1 and D3 reject the rest with observations (`git branch --merged main` listed only `main`; `--limit` truncation). Per-branch `gh` reads cost about 4 calls per start once the backlog is gone, which D3 accepts.",
      "result": "ok"
    },
    "map": {
      "evidence": "All 9 scenarios map to named tests. 'Merged change's worktree' maps to test_merged_changes_worktree: task 1.2 now gives `done` and `dirty` their PR heads and asserts the uncommitted-changes reason, and the scenario WHEN says the dirty one is at its merged PR's head, so the dirty check itself is proven. 'Merged change's branch' maps to test_merged_changes_branch (1.3), which also asserts no `gh pr view main`. 'Cleanup fails' maps to the three cases of test_cleanup_fails (1.4). 'Started from inside' gets the branch-survives and no-`gh pr view prev` assertions (1.4). The other 5 are unchanged.",
      "result": "ok"
    },
    "red": {
      "evidence": "Task 1.5 passes check_red only tests that fail on the current start_change.py. test_merged_changes_worktree fails because `done`'s branch survives today. test_merged_changes_branch fails because nothing deletes `gone` or prunes `origin/gone`. In test_cleanup_fails, the `git branch -D` and `git remote prune` cases fail because neither command runs today, so no `kept:` line appears. The `git worktree remove` case and test_started_from_inside_the_previous_changes_worktree pass today; they are named as regression guards and run in 2.1's pytest.",
      "result": "ok"
    },
    "platform": {
      "evidence": "Each decision now has its observation beside it. D1: `gh pr view` for a name reused by several PRs answered #435, and `git ls-remote origin refs/pull/434/head` = `001e7fff…`, the headRefOid of the merged PR. D3: the for-each-ref output on git 2.45.1.windows.1 is NUL-separated with a forward-slash absolute worktree path, so the path is resolved as a `Path` before the comparison. D4: on a scratch clone, `git remote prune origin` printed `* [pruned] origin/gone`, and afterwards `git branch -r` listed only `origin/main` while the local `gone` remained. The proposal's Why records `deleteBranchOnMerge` true and the per-branch state/headRefOid census.",
      "result": "ok"
    },
    "replaced": {
      "evidence": "Dropped guard: the prose rule in CLAUDE.md against force-deleting a branch, lifted for one path. No machine guard existed (ADR 0040 D5). D1 and D2 list the new input's failure modes: a reused name (observed), commits after the merge (kept), a dirty worktree (kept), a fresh branch from main (the squash SHA is never a PR head). Recovery is the observed refs/pull/<N>/head. The worktree predicate gets stricter.",
      "result": "ok"
    },
    "catcher": {
      "evidence": "The `kept:` lines on stderr come from start_change, which task 0.1 runs in the foreground, and the run exits 0. refs/pull/<N>/head restores a wrongly deleted branch and was observed in D1. The real-git tests 1.2–1.4 run in task 3.3's `test` and in the PR's required checks.",
      "result": "ok"
    },
    "length": {
      "evidence": "The spec delta adds about 105 words in three sentences: prune and delete under one condition, keep and name, and 'cleanup failure SHALL NOT fail the start'. Tests assert each clause:\n- prune: origin/gone deleted (1.3)\n- removal and deletion printed (1.2, 1.3)\n- cwd's worktree skipped (1.4)\n- main worktree's branch skipped: no `gh pr view main` (1.3)\n- dirty and differing-tip branches kept (1.2, 1.3)\n- failures kept with exit 0 (1.4)\n- other branches untouched (1.2, 1.3)\nThe deletion condition now governs both steps, matching D3. The SKILL.md (+3 words) and CLAUDE.md (about 13 words) edits are checked by greps in 2.2, and 2.1 rewrites the module docstring's cleanup rule.",
      "result": "ok"
    },
    "bespoke": {
      "evidence": "No new script or check. The change edits start_change.py's existing cleanup and uses standard git and gh commands: `for-each-ref`, `remote prune`, `branch -D`, `gh pr view`. D2 and D4 record why `update-ref -d`, `fetch --prune` and `fetch.prune` do not fit.",
      "result": "ok"
    }
  },
  "scenario_coverage": []
}
