{
  "verdict": "approve",
  "round": 2,
  "reviewer": "architect-reviewer",
  "reasoning": "Both round-1 findings are answered: the contract, spec, proposal and test now name the trusted/ path the review job actually reads, outside the default-branch list, and §I tags the existing test clause instead of restating it; the plan is the minimal extension of the existing P0/P1 class.",
  "classes": {
    "simpler": {
      "evidence": "design.md Decisions weighs naming the file only (rejected by the run 38692248603 observation in proposal.md Why), reading principles.md in full each run (about 3,400 tokens per turn against under 150 for the signals), and a separate severity bullet (a second scale); the chosen form extends the existing P0/P1 convention-violation sentence and the Policy source bullet of REVIEW_CONTRACT.md, with no workflow or prompt change.",
      "result": "ok"
    },
    "map": {
      "evidence": "specs/review-and-merge/spec.md has one scenario, 'Each principle has a severity'; tasks.md Scenario → test map maps it to tests/publisher/test_reusable_workflows.py::test_review_contract_labels_each_principle.",
      "result": "ok"
    },
    "red": {
      "evidence": "tasks.md 1.1 adds test_review_contract_labels_each_principle asserting the Policy source bullet names `trusted/skills/agent-process/principles.md` and the '`P0`/`P1` mean' bullet names each of §I–VI by a boundary-aware regex (which also keeps §V and §VI from matching the bullet's existing §VII); today's contract names neither, so it fails before 2.1. 1.2 runs check_red with its node id. Both anchors exist in the current contract, and the lifted _bullet_containing helper finds the Policy source bullet.",
      "result": "ok"
    },
    "platform": {
      "evidence": "proposal.md Why cites run 38692248603's own list of what the review read; design.md Context cites runs 38692248603 and 38690472058 for cost. The trusted/ layout is read from reusable-agent-review.yml: 'Checkout reviewed PR head' at the workspace root and 'Checkout trusted review source' (ekolvah/agent-process-distribution at job.workflow_sha) at path trusted, with the prompt naming `trusted/.agent-process/REVIEW_CONTRACT.md`.",
      "result": "ok"
    },
    "replaced": {
      "evidence": "No input is replaced and no guard dropped: the §VII triggers clause, the untrusted-worktree rule and the review workflow stay as they are (proposal.md What Changes, Impact).",
      "result": "ok"
    },
    "catcher": {
      "evidence": "The catcher is the Claude review step of reusable-agent-review.yml. Task 2.1 adds a clause of its own to the Policy source bullet, outside the default-branch list, naming `trusted/skills/agent-process/principles.md`: the file at job.workflow_sha that the step's trusted checkout holds in this repository and in every adopter, not the PR worktree's copy, which the same bullet already treats as untrusted data. Test 1.1 asserts that exact path; the spec requirement, its scenario and proposal.md name it.",
      "result": "ok"
    },
    "length": {
      "evidence": "Spec requirement: 29 words; its test asserts the trusted/ path and the six section labels (7 tokens). Task 2.1 adds a Policy source clause of about 9 words, a (§I) tag on the existing 'a failing or missing behavioural test' clause, and about 60 words of §II–VI signals plus the borderline-case deferral; the test asserts the path and the section labels, and the breach descriptions stay unasserted prompt prose, which is proportionate. No clause restates one already in the contract.",
      "result": "ok"
    },
    "bespoke": {
      "evidence": "The plan adds no script or check: it edits a prompt document and adds one test, reusing the lifted _bullet_containing helper rather than a second parser.",
      "result": "ok"
    }
  },
  "scenario_coverage": []
}
