{
  "verdict": "approve",
  "round": 2,
  "reviewer": "architect-reviewer",
  "reasoning": "All three round-1 findings are answered in spec, design and tasks with mapped tests, and the plan is the minimum that meets the person's two scenarios.",
  "classes": {
    "simpler": {
      "evidence": "Simpler candidates: archive_change records only its own session, with no ledger and no guard. The scenario 'Plan and implementation in two sessions' rules it out because it loses the planning session, and without the guard one session's cost lands in two rows. D1 rejects a hook, and D2 rejects a per-change file and issue comments, each with its reason. Retiring the launcher is deferred to a separate change (D6). The round-2 additions are a group-by, one exempted path and one bind point; none adds a new mechanism.",
      "result": "ok"
    },
    "map": {
      "evidence": "All 11 delta scenarios map to named tests, including the new 'Bound session without telemetry' (test_bound_session_without_telemetry) and 'Plan creates the issue' (test_plan_creates_the_issue). The D2, D3 and D4 tests listed in task 1.2: test_same_issue_binds_once, test_side_issue_refused_before_create, test_rerun_after_failed_archive.",
      "result": "ok"
    },
    "red": {
      "evidence": "Task 1.2 writes every mapped test against a session_binding.py signature stub and runs check_red. The unchanged scenarios (Re-run, Grafana unreachable) also fail first, because the test HEADER constant becomes the new column list, which the current upsert rejects. Task 1.1's conftest fixture is a harness precondition, not a test.",
      "result": "ok"
    },
    "platform": {
      "evidence": "Observed in proposal Why: session_id on every Loki api_request row and every Prometheus token series; Loki ids equal transcript names; CLAUDE_CODE_SESSION_ID equals the session's transcript name (re-seen in round 1: the subagent Bash shows the parent id). On record: `openspec archive` moves non-artifact files, since archived changes keep architect-review.json. That a resumed session keeps its id is listed as an unobserved risk, not a basis. The coordinator correctly notes that the setup document's observation concerns `instance`, not session-id continuity.",
      "result": "ok"
    },
    "replaced": {
      "evidence": "D5 lists the replaced input (the launcher's task_id becomes the archived sessions file), its three failure modes and their catchers, and why rule 1 is dropped. D4 now lists that the clean-worktree guard accepts the change's own `sessions` besides `tasks.md`, so a re-run rewrites it, tested by test_rerun_after_failed_archive.",
      "result": "ok"
    },
    "catcher": {
      "evidence": "(1) Unset variable: each script prints 'session not bound', then the task-readings run on the merge commit writes `telemetry: no bound session` and exits 1. (2) A hand-edited `sessions`: the PR review sees the archive-commit diff. (3) A bound id with no telemetry: the `start` query is now `min by (session_id)`, and a missing id is named in `gap`. task_readings.py returns 1 on any gap, so a partly exported task also ends red. Wording note, non-blocking: D5's last bullet says the run 'ends red when no bound session has a sample', but any gap ends it red. The implementer keeps the existing `1 if gaps else 0`.",
      "result": "ok"
    },
    "length": {
      "evidence": "Spec words, scenarios included: 'Merged task records its readings' about 225 (header rewrite asserted by test_file_with_an_earlier_header). 'Unreadable reading is a gap' about 154 (no-session and partial-session gaps asserted by test_task_without_telemetry and test_bound_session_without_telemetry). 'Telemetry follows the bound sessions' about 72 (test_parallel_session_of_another_task, window in test_task_pr_merged). 'A session leads one task' about 171, now refuse-then-bind with create_tracking_issue binding after the number is in tasks.md; asserted by exit 2, both issues named, no `gh issue develop` or `gh issue create`, the bound new number, and the not-bound message with continuation. 'The archive records the task's sessions' about 59 (test_plan_and_implementation_in_two_sessions). D3 places start_change's bind directly after the Planned check, before the prune.",
      "result": "ok"
    },
    "bespoke": {
      "evidence": "One new module, skills/agent-process/scripts/session_binding.py. Problem observed in proposal Why: 4 of 5 recent tasks carry `telemetry: no token sample`. Standards considered: D1 says no standard tool links a Claude Code session to an issue, and a hook would parse issue numbers out of Bash command lines. D2 rejects a per-change file and issue comments. It reuses start_change.tracking_issue, the injected runner and the exclude_worktrees read/append shape.",
      "result": "ok"
    }
  },
  "scenario_coverage": []
}
