{
  "verdict": "approve",
  "round": 2,
  "reviewer": "architect-reviewer",
  "reasoning": "The round-1 finding is answered: D1 now moves the per-task override to the rate field and hides the raw columns and api_requests, and test_rate_panels asserts both, so the one scenario is proven. The Infinity behaviour the design uses is observed.",
  "classes": {
    "simpler": {
      "evidence": "design.md D1 rejects a rate column written by task_readings.py (it would change the header for every adopter) and Grafana binary calculateField steps (two transformations per panel). Neither the spec nor the scenario needs anything heavier than one computed column per target. dashboard.py copies the whole prototype target (scripts/dashboard.py:45-47), so the new computed column reaches every repository's query without a code change.",
      "result": "ok"
    },
    "map": {
      "evidence": "One delta scenario, measurement / Rate panels, maps to tests/publisher/test_dashboard.py::test_rate_panels (tasks.md map). Task 1.1 now asserts the D1 computed column, the trend window over it, the per-task override matched on the rate field, and organize hiding the raw columns and api_requests. That covers 'draws its rate and windows its trend over it'. This answers the round-1 finding against D1 and 1.1.",
      "result": "ok"
    },
    "red": {
      "evidence": "Group 1: task 1.1 adds test_rate_panels and task 1.2 runs `agent-process check_red` on its node id, then commits RED with the ticks. The test fails today because panels 22 and 23 have only the `repository` computed column.",
      "result": "ok"
    },
    "platform": {
      "evidence": "The design rests on one platform behaviour: Infinity computed-column arithmetic and how it treats empty cells. design.md D1 records the observation (/api/ds/query on grafanacloud-infinity, 2026-10-17, both expressions): PR 401 gives 1.4598 and 6.5693, PR 433 gives 0, and PRs 385-397 give null. The filterByValue, organize and windowFunctions transformations are ones the template already uses on panel fields today (per-task-dashboard.json:1157-1236). Division by zero was not observed. The Risks section rests it on data (no row has api_requests 0 with a non-empty reading), not on platform behaviour.",
      "result": "ok"
    },
    "replaced": {
      "evidence": "No project-declared input is replaced. One guard changes: the empty-reading filterByValue moves from the raw columns to the rate column. D1's observation shows that an empty reading yields a null rate, so the same rows are still excluded. The removed binary calculateField is replaced by the expression rather than dropped.",
      "result": "ok"
    },
    "catcher": {
      "evidence": "The plan names one catcher, task 4.3. After merge it re-imports aqxk4q from `agent-process dashboard ekolvah/agent-process-distribution` and checks panel 23's /api/ds/query result for PR 401 against D1. The launcher prefers the current directory's skills/agent-process/scripts/ (plugin bin/agent-process), so in the worktree it renders the merged template, not the plugin release. A missing rate column would therefore show up as a mismatch in that query.",
      "result": "ok"
    },
    "length": {
      "evidence": "The plan adds one spec requirement of 36 words and one scenario of 22 words. Test 1.1 asserts the requirement's drawn rate (both expressions, the override on the rate field, the hidden raw columns) and the trend over it. 'Trailing mean' is unchanged template state that the window assertion reads. Task 2.2 edits a docs paragraph (§I docs-only exemption).",
      "result": "ok"
    },
    "bespoke": {
      "evidence": "The plan adds no script or check: the change is a template edit, one test, and a docs paragraph.",
      "result": "ok"
    }
  },
  "scenario_coverage": []
}
