{
  "verdict": "approve",
  "round": 2,
  "reviewer": "architect-reviewer",
  "reasoning": "Both round-1 findings are closed. The null-operand behaviour is now cited from Grafana source and handled by an extended null filter whose cost Risks records against the CSV, and test 1.1 asserts the unit, the step order and the filter.",
  "classes": {
    "simpler": {
      "evidence": "design.md D1 rejects a ×100 step and a CSV column, D2 rejects separate panels; the scenario keeps the count and trend, so replacing them with the rate is out. One ÷ step, one filter entry and one unit override is the least the scenario allows.",
      "result": "ok"
    },
    "map": {
      "evidence": "specs/measurement/spec.md has one scenario, 'Rate panels'; tasks.md Scenario → test map maps it to tests/publisher/test_dashboard.py::test_rate_panels, which task 1.1 creates.",
      "result": "ok"
    },
    "red": {
      "evidence": "Task 1.1 adds test_rate_panels using the existing helpers (tests/publisher/test_dashboard.py:38-61); task 1.2 runs check_red and commits RED before group 2 edits the template.",
      "result": "ok"
    },
    "platform": {
      "evidence": "Binary operation: Grafana 'Transform data' page. Null operands: design.md D1 cites calculateField.ts getBinaryCreator and binaryOperators.ts (main, read 2026-10-17): no null skip, Divide is a / b, so the result is Infinity/NaN. Right axis: 'Time series, Placement' page, plus an explicit override. percentunit display: read live for PR 401 in task 3.3.",
      "result": "ok"
    },
    "replaced": {
      "evidence": "The guard that changes is the null filter of panels 22 and 23, which now also excludes rows with an empty `api_requests`. design.md Risks bullet 1 lists the cost: such a row leaves the two charts but stays in the table with its `gap` (task_readings.py:201 records `api_requests: no api_request event`). It also gives the CSV observation: 5 of 27 rows, all with empty counts already, so no point drawn today disappears.",
      "result": "ok"
    },
    "catcher": {
      "evidence": "Template structure (filter entry, ÷ before organize, percentunit, right axis): test_rate_panels in groups 1 and 2, before archive. Grafana evaluation and the displayed value: the task 3.3 re-import of aqxk4q reading 1.46% for PR 401, before task 4.1 archive.",
      "result": "ok"
    },
    "length": {
      "evidence": "Requirement: 38 words. Scenario: 33 words. Task 1.1 asserts: `api_requests` read (selectors) and filtered, a binary ÷ step aliased `per 100 requests` placed before the organize that excludes `api_requests` ('but not api_requests'), unit percentunit ('per 100'), right axis. Not newly asserted: 'the count, its trend', which are existing template structure this change keeps.",
      "result": "ok"
    },
    "bespoke": {
      "evidence": "The plan adds no script or check: one template edit and one pytest test in an existing file, through existing helpers.",
      "result": "ok"
    }
  },
  "scenario_coverage": [
    {
      "capability": "measurement",
      "scenario": "Rate panels",
      "reason": "Partly: the test proves the template structure only; Grafana evaluating the transformations and the unit (1.46% for PR 401) is checked by the task 3.3 re-import of aqxk4q (design.md Risks, bullet 2)."
    }
  ]
}
