{
  "verdict": "approve",
  "round": 3,
  "reviewer": "architect-reviewer",
  "reasoning": "Both round-2 findings are closed. D3 now rests on start_change's own `--track origin/<change>` upstream and the observed Phase 0 default diff, and gives a stated reason for rejecting the path target. The Verify test asserts the clause's own words, and every class traces to an observation, a test or a reached catcher.",
  "classes": {
    "simpler": {
      "evidence": "design.md D1 rejects three options: reuse/altitude schema classes, a project skill named `simplify` (it would run 'right before each commit'), and a hook. The Non-Goals give the reason against skipping the pass by size or kind of change. The code pass now uses the simplest target, bare `/simplify` on its default diff, inside the fixed Verify text. Each pass is one SKILL.md clause plus one test. openspec/config.yaml defers its `tasks` rule to SKILL.md#tasks and restates neither step, so nothing else needs editing.",
      "result": "ok"
    },
    "map": {
      "evidence": "planning 'Plan written' maps to tests/publisher/test_planning_workflow.py::test_simplify_precedes_the_architect_review. implementation 'Implementation done' maps to ::test_simplify_opens_verify. tasks.md 1.1, the check_red node ids and the Scenario -> test map use the same names, and both delta scenarios have an entry.",
      "result": "ok"
    },
    "red": {
      "evidence": "Group 1 task 1.1 adds both tests on the existing _skill()/_section() helpers (test file lines 42-52) and runs check_red on both node ids before Group 2. `simplify` does not appear in SKILL.md today, so both tests fail. `once` is not in the current `## Architect review` section, so that assertion discriminates too. The new clauses leave the existing tests green. test_plan_approved stays green because the clauses add no `\\bask` word. test_plan_is_explained_for_solution_review stays green because the addition follows `plain words`. tasks.md 2.1 keeps the item numbers, so the ` 4. Verify`/` 5. ` slices of test_verify_runs_the_repository_quality_command and test_group_commits_carry_their_ticks, including the `archive commit` assertion, still hold.",
      "result": "ok"
    },
    "platform": {
      "evidence": "Agent invocation and the path target on the change directory are observed: the propose run of this change ran `/simplify openspec/changes/simplify-before-review/` through the Skill tool, and the proposal records its `Review target:` line and the Phase 0 text. The default diff `git diff @{upstream}...HEAD`, with `main...HEAD` as the fallback, is the same observed Phase 0 text. The upstream comes from the start_change docstring (skills/agent-process/scripts/start_change.py lines 24-27): `gh issue develop` from the default branch, then `git worktree add --track -b <change> ... origin/<change>`. The archive is the first push (archive_change.py line 111, after the plan commit was 'not pushed'), so at Verify the default diff is exactly the branch's commits. The fallback also yields those commits. D3 rejects the path target because the observation covers only untracked new files. That is a stated limit of the evidence, not an asserted behaviour.",
      "result": "ok"
    },
    "replaced": {
      "evidence": "No project-declared input is replaced and no guard is dropped. Both passes are added steps. The architect-reviewer, its schema, the CI review and .claude/rules/workflow.md are unchanged (design.md Non-Goals).",
      "result": "ok"
    },
    "catcher": {
      "evidence": "Plan pass: defects its edits introduce reach the first architect review in the same propose run (D2), so they are caught. A plan pass that did not run surfaces in the plain-words explanation, and Risks records it as an accepted, unscripted gap. Code pass: its edits reach `openspec validate --strict --all` and the quality `test` (tasks.md 3.2, 3.3) on the same head. Uncommitted edits are refused by archive_change's dirty-worktree check (archive_change.py line 98), which backs 'its edits committed'. The CI agent-review then runs on the head archive_change pushes. D3 names that review as the catcher for edits to the plan commit in the default diff, and it is reached, because the archived change directory and the merged specs are in the PR diff. A code pass that did not run is recorded in the 3.1 tick, and an unavailable skill falls under the same accepted gap.",
      "result": "ok"
    },
    "length": {
      "evidence": "Planning requirement, 33 words. Its test asserts `/simplify openspec/changes/<change>/` before `architect-reviewer`, plus `once` and `what /simplify changed` (about 8 words). 'After tasks.md' is already carried by the existing first sentence, and 'first'/'per propose run' are implied by `once`. Implementation requirement, 25 words. Its test asserts, in the ` 4. Verify` slice, `/simplify` without an argument before `openspec validate`, the clause's own words (about 6 words). The quality `test` is already asserted by test_verify_runs_the_repository_quality_command. 'its edits committed' is enforced by archive_change's dirty-worktree refusal. The SKILL.md clauses of tasks.md 2.1 are about 15 and 15 words, and no clause falls outside the issue. Note for implementation: assert the literal phrase '`/simplify` without an argument' rather than `/simplify` alone, or the test cannot tell this clause from a path-target clause.",
      "result": "ok"
    },
    "bespoke": {
      "evidence": "The plan adds no script or check. It uses the bundled /simplify. design.md D1 names the problem (the observed runs in the tracking issue) and explains why a schema class, a project skill or a hook does not fit.",
      "result": "ok"
    }
  },
  "scenario_coverage": []
}
